{
  "$schema": "../../../schemas/rejected-output-recovery.schema.json",
  "schemaVersion": 1,
  "projectSlug": "vox-depth-stack-pilot-submarine",
  "attemptId": "img-96e9ca5e-f523-4962-a0b2-ebc2b4ed402f",
  "historicalRequest": "projects/vox-depth-stack-pilot-submarine/requests/submarine-layer-sheet.json",
  "source": {
    "file": "public/projects/vox-depth-stack-pilot-submarine/assets/environment/submarine-layer-sheet-provider-raw-attempt-2.png",
    "sha256": "c4cf5ecb0e9bb80ed7d0973b7b304c251188bde6df06681953e0b68360346d02"
  },
  "recoveryAssetId": "submarine-layer-sheet",
  "reason": "attempt-2-provider-native-observed-key-plane-recovery",
  "cells": [
    {
      "packageRole": "subject",
      "sourceRect": {
        "left": 0,
        "top": 627,
        "width": 627,
        "height": 627
      },
      "keyPlane": {
        "mode": "provider-native-observed",
        "policyId": "flat-v1"
      }
    },
    {
      "packageRole": "support-front",
      "sourceRect": {
        "left": 627,
        "top": 627,
        "width": 627,
        "height": 627
      },
      "keyPlane": {
        "mode": "provider-native-observed",
        "policyId": "flat-v1"
      }
    }
  ]
}
